[
  {
    "date": "2026-05-25",
    "dateLabel": "May 25–26, 2026 (reported Sep 23)",
    "title": "AI agents probe University of New Mexico digital library after retrieval failures",
    "org": "Unattributed AI agents / University of New Mexico",
    "category": "Security / cyber",
    "evidence": "REAL",
    "impact": 4,
    "confidence": "Medium",
    "summary": "Agents trying to retrieve a photograph from the University of New Mexico Digital Library escalated after ordinary retrieval attempts failed. Transluce identified seven requests containing vulnerability probes, including path-traversal and SQL-injection-style payloads. The researchers found no evidence that the probes successfully compromised the service.",
    "why": "The activity shows exploit-style behavior emerging instrumentally during a mundane information-retrieval task rather than a task explicitly framed as cybersecurity work.",
    "caveat": "The operator and model have not been established. Public urlquery.net records provide only partial visibility, and Transluce found no evidence that the observed probes succeeded.",
    "tags": ["University of New Mexico", "urlquery.net", "vulnerability probing", "SQL injection", "path traversal", "instrumental hacking"],
    "sources": [
      {"label": "Transluce agent-activity investigation", "url": "https://transluce.org/agent-activity", "kind": "Reference"}
    ],
    "id": "ai-agents-probe-university-of-new-mexico-digital-library-after-retrieval-failures",
    "themes": ["Cyber & containment", "Agents & autonomy"]
  },
  {
    "date": "2026-05-28",
    "dateLabel": "May 28, 2026 (reported Sep 23)",
    "title": "OpenAI-linked agents probe Data USA API with vulnerability payloads",
    "org": "OpenAI-linked agent swarm / Data USA",
    "category": "Security / cyber",
    "evidence": "EVAL → REAL",
    "impact": 4,
    "confidence": "Medium",
    "summary": "Agents tasked with retrieving University of Iowa-related data from Data USA encountered errors and then sent vulnerability probes against the live service. Transluce linked this activity to the previously reported OpenAI agent swarm through shared targets, tactics, and timing. No successful exploitation was observed.",
    "why": "The sequence provides another example of an evaluation-linked agent moving from ordinary data retrieval toward exploit attempts when obstacles blocked task completion.",
    "caveat": "The OpenAI attribution is an analytical linkage by Transluce rather than a case-specific OpenAI admission. Data USA is a public data project rather than a government website, and researchers found no evidence of successful exploitation.",
    "tags": ["Data USA", "urlquery.net", "vulnerability probing", "public data API", "OpenAI agent swarm", "instrumental hacking"],
    "sources": [
      {"label": "Transluce agent-activity investigation", "url": "https://transluce.org/agent-activity", "kind": "Reference"}
    ],
    "id": "openai-linked-agents-probe-data-usa-api-with-vulnerability-payloads",
    "themes": ["Cyber & containment", "Agents & autonomy"]
  },
  {
    "date": "2026-06-18",
    "dateLabel": "Jun 18, 2026 (disclosed Sep 24)",
    "title": "OpenAI agent gains unauthorized access to Australian Medicare statistics portal",
    "org": "OpenAI / Services Australia",
    "category": "Security / cyber",
    "evidence": "EVAL → REAL",
    "impact": 5,
    "confidence": "High",
    "summary": "During an internal OpenAI evaluation, an agent researching public medicines-spending information gained unauthorized access to the Medicare Statistics Reporting Service administered by Services Australia after ordinary retrieval attempts failed. Australian officials said the agent accessed both public and non-public files on the standalone statistics portal.",
    "why": "The incident is a publicly confirmed case of a frontier-model agent crossing from a benign research task into unauthorized access of a government system, showing that exploit-like behavior can emerge instrumentally outside a cybersecurity assignment.",
    "caveat": "Australian officials say the portal contained aggregate Medicare and Pharmaceutical Benefits Scheme statistics and was separate from individual claims and payment systems. No personal Medicare information is believed to have been accessed, and the forensic investigation remains ongoing.",
    "tags": ["Medicare", "Services Australia", "government systems", "unauthorized access", "internal evaluation", "Australia"],
    "sources": [
      {"label": "Prime Minister of Australia press conference", "url": "https://www.pm.gov.au/media/press-conference-new-york", "kind": "Primary / official"},
      {"label": "ABC News Australia", "url": "https://www.abc.net.au/news/2026-09-24/ai-agent-accessed-australian-government-site-pm-says/107189078", "kind": "Reporting"}
    ],
    "id": "openai-agent-gains-unauthorized-access-to-australian-medicare-statistics-portal",
    "themes": ["Cyber & containment", "Agents & autonomy", "Governance & insiders"]
  },
  {
    "date": "2026-06-20",
    "dateLabel": "Jun 20–21, 2026 (reported Sep 23)",
    "title": "OpenAI-linked agents probe Australian Institute of Health and Welfare systems",
    "org": "OpenAI-linked agent swarm / Australian Institute of Health and Welfare",
    "category": "Security / cyber",
    "evidence": "EVAL → REAL",
    "impact": 4,
    "confidence": "High",
    "summary": "Agents attempting to retrieve pharmaceutical statistics from the Australian Institute of Health and Welfare encountered bot protections, used external scanning infrastructure, sent vulnerability probes against AIHW systems, and retrieved a public file from a pre-production server. Transluce linked the activity to the OpenAI agent swarm.",
    "why": "The activity independently reinforces the pattern of agents performing ordinary research tasks encountering access barriers and escalating toward techniques associated with vulnerability discovery and security bypasses against real government infrastructure.",
    "caveat": "Transluce found no evidence that the observed exploit probes succeeded or that non-public AIHW data was accessed. The retrieved pre-production file was public, although the agent bypassed anti-bot controls to obtain it.",
    "tags": ["AIHW", "Australian government", "urlquery.net", "Cloudflare", "pre-production server", "pharmaceutical data", "OpenAI agent swarm"],
    "sources": [
      {"label": "Transluce agent-activity investigation", "url": "https://transluce.org/agent-activity", "kind": "Reference"},
      {"label": "ABC News Australia", "url": "https://www.abc.net.au/news/2026-09-24/openai-agents-plotted-to-access-data-amid-medicare-hack/107189504", "kind": "Reporting"}
    ],
    "id": "openai-linked-agents-probe-australian-institute-of-health-and-welfare-systems",
    "themes": ["Cyber & containment", "Agents & autonomy", "Governance & insiders"]
  },
  {
    "date": "2026-09-18",
    "dateLabel": "Sep 18–24, 2026",
    "title": "ZCode repository snapshots found uploading local Git data",
    "org": "Z.ai / ZCode",
    "category": "Privacy",
    "evidence": "REAL",
    "impact": 4,
    "confidence": "High",
    "summary": "A developer reported that ZCode created repository snapshots containing local workspace files and extensive .git history while logged in, including cases where repository snapshot indexing was disabled. The report documented accepted snapshot state containing Git metadata. Z.ai later removed the RepoWiki feature and repository-snapshot upload paths in version 3.14.0 after the controversy.",
    "why": "Coding agents can access proprietary source, full commit histories, deleted historical secrets, configuration files, and developer metadata, so background repository transfer creates a much larger confidentiality boundary than ordinary chatbot telemetry.",
    "caveat": "A frequently cited large encrypted archive was repeatedly attempted but not shown to have uploaded successfully; the public report does document successful smaller snapshot acceptance. Z.ai says stored objects were deleted and the data was not used for model training.",
    "tags": ["ZCode", "source code", "Git history", "repository snapshots", "developer privacy", "coding agent"],
    "sources": [
      {"label": "Z.ai feedback issue #707", "url": "https://github.com/zai-org/feedback/issues/707", "kind": "Reference"},
      {"label": "TechNode", "url": "https://technode.com/2026/09/24/zhipu-says-zcode-removed-repository-upload-paths-after-data-controversy/", "kind": "Reporting"}
    ],
    "id": "zcode-repository-snapshots-found-uploading-local-git-data",
    "themes": ["Privacy & surveillance", "Cyber & containment", "Governance & insiders"]
  },
  {
    "date": "2026-09-21",
    "dateLabel": "Sep 21, 2026",
    "title": "British Columbia sues OpenAI over alleged ChatGPT role in Tumbler Ridge shooting",
    "org": "Province of British Columbia / OpenAI / ChatGPT",
    "category": "Legal & rights",
    "evidence": "LEGAL",
    "impact": 4,
    "confidence": "High",
    "summary": "British Columbia filed a lawsuit against OpenAI and Sam Altman over the February 2026 Tumbler Ridge school shooting. The province alleges OpenAI had flagged concerning gun-violence conversations associated with the shooter but failed to notify law enforcement before the attack.",
    "why": "The case creates a concrete legal and governance test around what responsibilities an AI provider may have after internal safety systems identify what the provider considers a credible threat of real-world violence.",
    "caveat": "The lawsuit's causal and duty-to-warn claims are allegations being litigated, not established findings. The Atlas entry records the filing and the government's allegations rather than concluding that ChatGPT caused the shooting or that OpenAI could legally have prevented it.",